<?xml version="1.0" encoding="UTF-8"?>
<!DOCTYPE libros1 SYSTEM "libros1.dtd">
<libros1>
    <libro isbn = "aaaaa">
        <titulo></titulo>
        <autores>
            <autor>
                <nombre></nombre>
                <apellidos></apellidos>
                <email></email>
            </autor>
        </autores>
        <editorial>
            <nombre></nombre>
            <oficina></oficina>
            <pagina></pagina>
        </editorial>
        <revisores>
            <revisor>
                <nombre></nombre>
                <puntuacion></puntuacion>
                <comentario></comentario>
            </revisor>
        </revisores>
    </libro>
</libros1>